rank,uri,artist_names,track_name,source,peak_rank,previous_rank,weeks_on_chart,streams
1,"spotify:track:6u7jPi22kF8CTQ3rb9DHE7","Lil Nas X, Billy Ray Cyrus","Old Town Road - Remix","Columbia",1,-1,1,"20673623"
2,"spotify:track:53CJANUxooaqGOtdsBTh7O","Lil Nas X","Old Town Road","Columbia",2,2,6,"15186440"
3,"spotify:track:2Fxmhks0bxGSBdJ92vM42m","Billie Eilish","bad guy","Darkroom/Interscope Records",1,1,2,"13890824"
4,"spotify:track:3KkXRkHbMCARz0aVfEt68P","Post Malone, Swae Lee","Sunflower - Spider-Man: Into the Spider-Verse","Universal Records",1,6,25,"8696363"
5,"spotify:track:3Fj47GNK2kUF0uaEDgXLaD","Billie Eilish","wish you were gay","Darkroom/Interscope Records",3,3,6,"8165235"
6,"spotify:track:2JvzF1RMd7lE3KmFlsyZD8","J. Cole","MIDDLE CHILD","Dreamville, Inc., Under exclusive license to Roc Nation Records",1,9,12,"7808654"
7,"spotify:track:1wJRveJZLSb1rjhnUHQiv6","A Boogie Wit da Hoodie, 6ix9ine","Swervin (feat. 6ix9ine)","Highbridge the Label / Atlantic Records",7,12,16,"7378430"
8,"spotify:track:6TqXcAFInzjp0bODyvrWEq","Khalid, Disclosure","Talk (feat. Disclosure)","Right Hand Music Group, LLC/RCA Records",8,28,9,"7292412"
9,"spotify:track:09oZ9eXQ2fo6YDrPzJqAoP","Khalid, John Mayer","Outta My Head (with John Mayer)","Right Hand Music Group, LLC/RCA Records",9,-1,1,"7094716"
10,"spotify:track:6zeeWid2sgw4lap2jV61PZ","Khalid","Better","Right Hand Music Group, LLC/RCA Records",9,40,30,"6978918"
11,"spotify:track:6MWtB6iiXyIwun0YzU6DFP","Post Malone","Wow.","Republic Records",2,14,16,"6948506"
12,"spotify:track:4SSnFejRGlZikf02HLewEF","Billie Eilish","bury a friend","Darkroom/Interscope Records",3,4,11,"6887623"
13,"spotify:track:2XKFnwB6djxrJCjR3PdeRb","Khalid","My Bad","Right Hand Music Group, LLC/RCA Records",13,38,5,"6679962"
14,"spotify:track:7eBqSVxrzQZtK2mmgRG6lC","YNW Melly","Murder On My Mind","P2018",4,13,29,"6618213"
15,"spotify:track:2IRZnDFmlqMuOrYOLnZZyc","Meek Mill, Drake","Going Bad (feat. Drake)","MMG/Atlantic",2,16,19,"6523365"
16,"spotify:track:6ocbgoVGwYJhOv1GgI9NsF","Ariana Grande","7 rings","Republic Records",1,15,12,"6439592"
17,"spotify:track:4y3OI86AEP6PQoDE6olYhO","Jonas Brothers","Sucker","Jonas Brothers Recording",1,19,6,"6385996"
18,"spotify:track:43zdsphuZLzwA9k4DJhU0I","Billie Eilish","when the party's over","Darkroom/Interscope Records",5,5,26,"6176551"
19,"spotify:track:6tsOcBnaKgzK22yEiqRh8P","Ariana Grande, Victoria Monét","MONOPOLY (with Victoria Monét)","Republic Records",19,52,2,"5512870"
20,"spotify:track:63cd4JkwGgYJrbOizbfmsp","Mustard, Migos","Pure Water (with Migos)","10 Summers Records/Interscope Records",13,25,12,"5453259"
21,"spotify:track:6vWEAOUSxohKxhp0K1BsxL","YNW Melly, Kanye West","Mixed Personalities (feat. Kanye West)","P2019",12,24,12,"5324871"
22,"spotify:track:6Hj9jySrnFppAI0sEMCZpJ","Juice WRLD","Robbery","Grade A Productions/Interscope Records",3,22,8,"5229177"
23,"spotify:track:5kfNriitmkNE8mUbZ7gbq8","Khalid","Saturday Nights","Right Hand Music Group, LLC/RCA Records",14,55,24,"5131881"
24,"spotify:track:4kV4N9D1iKVxx1KLvtTpjS","Ariana Grande","break up with your girlfriend, i'm bored","Republic Records",1,21,9,"5080706"
25,"spotify:track:3Tc57t9l2O8FwQZtQOvPXK","Billie Eilish","my strange addiction","Darkroom/Interscope Records",10,10,2,"5076956"
26,"spotify:track:4QIo4oxwzzafcBWkKjDpXY","Billie Eilish","xanny","Darkroom/Interscope Records",7,7,2,"4998364"
27,"spotify:track:3XF5xLJHOQQRbWya6hBp7d","Billie Eilish","you should see me in a crown","Darkroom/Interscope Records",11,11,24,"4973748"
28,"spotify:track:1E6DEDWDKHoOW0fcFuDghV","Khalid, SAFE","Don't Pretend (feat. SAFE)","Right Hand Music Group, LLC/RCA Records",28,-1,1,"4973336"
29,"spotify:track:6IRdLKIyS4p7XNiP8r6rsx","Billie Eilish","all the good girls go to hell","Darkroom/Interscope Records",8,8,2,"4909126"
30,"spotify:track:4pUCKHjJ4Ijewc37rRrvHn","BLACKPINK","Kill This Love","YG Entertainment, distributed through Interscope Records",30,-1,1,"4767088"
31,"spotify:track:2t8yVaLvJ0RenpXUIAC52d","21 Savage","a lot","Slaughter Gang, LLC/Epic Records",7,26,16,"4644463"
32,"spotify:track:78QR3Wp35dqAhFEc2qAGjE","Lil Baby, Gunna","Drip Too Hard (Lil Baby & Gunna)","Quality Control Music/Young Stoner Life Records, a 300 Entertainment Label/Motown Records/Capitol Records",1,27,30,"4620959"
33,"spotify:track:6ya8ejoKgw906Y8LWclqrp","Nipsey Hussle, Roddy Ricch, Hit-Boy","Racks in the Middle (feat. Roddy Ricch and Hit-Boy)","Atlantic Records",33,58,2,"4493543"
34,"spotify:track:3QmolSZqjjLksTUvZJ6pPS","Jonas Brothers","Cool","Jonas Brothers Recording",34,-1,1,"4324557"
35,"spotify:track:1ThmUihH9dF8EV08ku5AXN","Ski Mask The Slump God","Faucet Failure","Republic Records",29,30,18,"4207689"
36,"spotify:track:2vsuel3g4zaLYSOY0mOMbi","Khalid","Bad Luck","Right Hand Music Group, LLC/RCA Records",36,-1,1,"4146097"
37,"spotify:track:3Ol2xnObFdKV9pmRD2t9x8","A Boogie Wit da Hoodie","Look Back at It","Highbridge the Label / Atlantic Records",9,35,18,"4039101"
38,"spotify:track:05t7JMip6JrLuSrMV5yYjX","Calboy","Envy Me","Polo Grounds Music/RCA Records",37,37,15,"4015447"
39,"spotify:track:5p7ujcrUXASCNwRaWNHR1C","Halsey","Without Me","Capitol Records",5,34,27,"3987874"
40,"spotify:track:1NJcg626wLln4pGHpiV7mf","Billie Eilish, Khalid","lovely (with Khalid)","Darkroom",24,41,51,"3971050"
41,"spotify:track:2qxmye6gAegTMjLKEBoR3d","Alec Benjamin","Let Me Down Slowly","2018",41,51,13,"3949567"
42,"spotify:track:2xLMifQCjDGFmkHkpNLD9h","Travis Scott","SICKO MODE","Cactus Jack / Epic / Grand Hustle",1,32,36,"3945982"
43,"spotify:track:5A1w94uzc1kO1Zhe8WWxC3","Khalid","Right Back","Right Hand Music Group, LLC/RCA Records",43,-1,1,"3945373"
44,"spotify:track:2dpaYNEQHiRxtZbfNsse99","Marshmello, Bastille","Happier","Astralwerks",8,36,34,"3937560"
45,"spotify:track:6CcJMwBtXByIz4zQLzFkKc","Billie Eilish","i love you","Darkroom/Interscope Records",17,17,2,"3880613"
46,"spotify:track:3oh6SCCeLuXhFpEyepla6G","Blueface","Thotiana","Fifth Amendment Entertainment/eOne Music",9,31,14,"3863457"
47,"spotify:track:3e9HZxeyfWwjeyPAMmWSSQ","Ariana Grande","thank u, next","Republic Records",1,33,23,"3836034"
48,"spotify:track:5icOoE6VgqFKohjWWNp0Ac","Marshmello, CHVRCHES","Here With Me","Marshmello/Republic",16,39,5,"3818561"
49,"spotify:track:2kAIpGWnlFLQh48iut6Zzq","Khalid","Free Spirit","Right Hand Music Group, LLC/RCA Records",49,-1,1,"3784529"
50,"spotify:track:7qEKqBCD2vE5vIBsrUitpD","Billie Eilish","ilomilo","Darkroom/Interscope Records",18,18,2,"3757979"
51,"spotify:track:7FGq80cy8juXBCD2nrqdWU","benny blanco, Halsey, Khalid","Eastside (with Halsey & Khalid)","Friends Keep Secrets/Interscope Records",10,46,39,"3639599"
52,"spotify:track:285pBltuF7vW8TeWk8hdRR","Juice WRLD","Lucid Dreams","Juice WRLD Mixtape / ISR P&D",1,42,49,"3576569"
53,"spotify:track:0tMSssfxAL2oV8Vri0mFHE","Billie Eilish","listen before i go","Darkroom/Interscope Records",20,20,2,"3545319"
54,"spotify:track:7njKgVl3AnLflRad38o7AG","Bazzi","Paradise","iamcosmic",54,-1,1,"3510962"
55,"spotify:track:6Qs4SXO9dwPj5GKvVOv8Ki","Sam Smith, Normani","Dancing With A Stranger (with Normani)","Capitol",12,43,13,"3406610"
56,"spotify:track:5BfMJ6iytQnu1r7iiCYSXe","Khalid","Intro","Right Hand Music Group, LLC/RCA Records",56,-1,1,"3381544"
57,"spotify:track:0HEckRWFSknIupbGzavk5d","Khalid","Hundred","Right Hand Music Group, LLC/RCA Records",57,-1,1,"3359118"
58,"spotify:track:1xzBco0xcoJEDXktl7Jxrr","Sheck Wes","Mo Bamba","Cactus Jack Records/ G.O.O.D. Music/ Interscope Records",1,49,37,"3353220"
59,"spotify:track:2VxeLyX666F8uXCJ0dZF8B","Lady Gaga, Bradley Cooper","Shallow","A Star is Born OST",10,48,28,"3336838"
60,"spotify:track:7dt6x5M1jzdTEt8oCbisTK","Post Malone","Better Now","Republic Records",1,50,50,"3333363"
61,"spotify:track:0PG9fbaaHFHfre2gUVo7AN","Cardi B, Bruno Mars","Please Me","Atlantic/KSR",15,44,8,"3331291"
62,"spotify:track:4ZT9FnbFu1PaBfV3itxiqT","Lil Skies","I","All We Got Ent.",16,45,6,"3210807"
63,"spotify:track:0FZ4Dmg8jJJAPJnvBIzD9z","Kodak Black, Offset, Travis Scott","ZEZE (feat. Travis Scott & Offset)","Atlantic Records",1,47,26,"3170310"
64,"spotify:track:6X29iaaazwho3ab7GNue5r","Billie Eilish","8","Darkroom/Interscope Records",23,23,2,"3159641"
65,"spotify:track:6fOOKqQWcSy33ApU1wqkkW","Khalid","Paradise","Right Hand Music Group, LLC/RCA Records",65,-1,1,"3159605"
66,"spotify:track:1WqLtczgKdbHFHhefOU0y7","Khalid","Self","Right Hand Music Group, LLC/RCA Records",66,75,2,"3151953"
67,"spotify:track:1NgCWYuBLfqBDA3b8MgSVU","Khalid","Twenty One","Right Hand Music Group, LLC/RCA Records",67,-1,1,"3082816"
68,"spotify:track:3ee8Jmje8o58CHK66QrVC2","XXXTENTACION","SAD!","Bad Vibes Forever, LLC",1,54,58,"3048819"
69,"spotify:track:7COXchtUOMd6uIT6HvmRaI","Lauv, Troye Sivan","i'm so tired...","Lauv",23,56,11,"2969044"
70,"spotify:track:2rxQMGVafnNaRaXlRMWPde","Luke Combs","Beautiful Crazy","River House Artists/Columbia Nashville",66,66,41,"2916199"
71,"spotify:track:3KLo7ByvjCNyBrfz5DZ2mO","Rich The Kid","Splashin","Interscope Records",27,53,17,"2889829"
72,"spotify:track:14mHfNsSHN0FbLftyjrV9g","Flipp Dinero","Leave Me Alone","Cinematic/Epic/We The Best",10,61,35,"2869715"
73,"spotify:track:5WHTFyqSii0lmT9R21abT8","Mabel","Don't Call Me Up","Polydor Records",69,71,9,"2849382"
74,"spotify:track:2G1tXoGBaEMJ7FKGnkf6ud","Gucci Mane, Bruno Mars, Kodak Black","Wake Up in the Sky","Guwop Enterprises/Atlantic",6,57,30,"2828477"
75,"spotify:track:0JP9xo3adEtGSdUEISiszL","XXXTENTACION","Moonlight","Bad Vibes Forever, LLC",3,60,56,"2769426"
76,"spotify:track:1rqqCSm0Qe4I9rUvWncaom","Panic! At The Disco","High Hopes","DCD2 / Fueled By Ramen",13,67,43,"2756073"
77,"spotify:track:3npzogdOEiVsieXmmhBepL","Maren Morris","The Bones","Columbia Nashville",60,68,5,"2739293"
78,"spotify:track:5wujBwqG7INdStqGd4tRMX","Juice WRLD","Armed And Dangerous","Juice WRLD Mixtape / ISR P&D",9,63,22,"2701791"
79,"spotify:track:0e7ipj03S05BNilyu5bRzt","Post Malone, 21 Savage","rockstar (feat. 21 Savage)","Republic Records",1,73,82,"2682201"
80,"spotify:track:42w7pX3r1TpLR0i55Ek5ND","Khalid","Bluffin'","Right Hand Music Group, LLC/RCA Records",80,-1,1,"2664734"
81,"spotify:track:2GGMabyHXnJmjY6CXhhB2e","Cardi B","Money","Atlantic/KSR",17,64,25,"2649085"
82,"spotify:track:25sgk305KZfyuqVBQIahim","Ava Max","Sweet but Psycho","Atlantic Records",36,76,27,"2609033"
83,"spotify:track:1fewSx2d5KIZ04wsooEBOz","Metro Boomin, Gunna","Space Cadet (feat. Gunna)","Republic Records",20,72,23,"2564532"
84,"spotify:track:40T5GIqQ1CegGm2PTEl8Bu","Billie Eilish","idontwannabeyouanymore","Darkroom",48,62,39,"2525249"
85,"spotify:track:5w9c2J52mkdntKOmRLeM2m","Daddy Yankee, Snow","Con Calma","El Cartel Records (EC3)",45,69,9,"2489717"
86,"spotify:track:12VqHHz4wvVcnEdSivjLeQ","Khalid","Alive","Right Hand Music Group, LLC/RCA Records",86,-1,1,"2486612"
87,"spotify:track:2H4gf1wLxvYreMj1jcaN0k","Dean Lewis","Be Alright","Universal Music Australia Pty. Ltd.",31,80,37,"2485739"
88,"spotify:track:3XiNC94b4Tq1xwv70sQJGN","Lil Uzi Vert","Sanguine Paradise","Generation Now/Atlantic",88,-1,1,"2434075"
89,"spotify:track:13ZyrkCDmRz5xY3seuAWYk","Juice WRLD","Hear Me Calling","Grade A Productions/Interscope Records",16,65,6,"2431218"
90,"spotify:track:5AjINjwKyRvQJhSe2zpPHi","Polo G, Lil Tjay","Pop Out (feat. Lil Tjay)","Columbia",86,86,3,"2424030"
91,"spotify:track:7m9OqQk4RVRkw9JJdeAw96","XXXTENTACION","Jocelyn Flores","Bad Vibes Forever / EMPIRE",3,81,85,"2420263"
92,"spotify:track:577YBGuskWkVDCxZrLRB4v","Lil Baby","Pure Cocaine","Quality Control Music/Motown Records/Capitol Records",52,70,19,"2397199"
93,"spotify:track:3A2yGHWIzmGEIolwonU69h","City Girls","Act Up","Quality Control Music/Motown Records",87,87,6,"2390220"
94,"spotify:track:116H0KvKr2Zl4RPuVBruDO","Bad Bunny, Drake","MIA (feat. Drake)","OVO Sound/Warner Records",2,84,26,"2386266"
95,"spotify:track:75ZvA4QfFiZvzhj2xkaWAh","Post Malone","I Fall Apart","Universal Records",2,93,82,"2374967"
96,"spotify:track:0NJp8GyCOWnQh71xKSPfuV","Tory Lanez","Freaky","Mad Love/Interscope Records",79,79,4,"2372291"
97,"spotify:track:0fcq51a3gOI6gPvzc0YLsk","Post Malone, Roddy Ricch, Tyga","Wow. - Remix","Republic Records",75,82,4,"2353762"
98,"spotify:track:5IaHrVsrferBYDm0bDyABy","Tyga, Offset","Taste (feat. Offset)","Last Kings Music / EMPIRE",4,94,47,"2347962"
99,"spotify:track:0TlLq3lA83rQOYtrqBqSct","Drake","Nonstop","Cash Money/Drake LP6",1,88,41,"2342389"
100,"spotify:track:3LgWsmilsrWXiPYQFRD0T7","Billie Eilish","goodbye","Darkroom/Interscope Records",29,29,2,"2342287"
101,"spotify:track:3swc6WTsr7rl9DqQKQA55C","Post Malone, Ty Dolla $ign","Psycho (feat. Ty Dolla $ign)","Republic Records",2,95,59,"2338976"
102,"spotify:track:0Hgqglypzt6Qs5Duqskcqs","Khalid","Heaven","Right Hand Music Group, LLC/RCA Records",102,-1,1,"2334364"
103,"spotify:track:4hqOmrCCJKyiuwDexd8c2t","NAV, The Weeknd","Price On My Head (feat. The Weeknd)","XO Records, LLC and Republic Records",42,77,3,"2307566"
104,"spotify:track:6vN77lE9LK6HP2DewaN6HZ","Lil Baby, Drake","Yes Indeed","Quality Control Music, LLC",2,98,48,"2300132"
105,"spotify:track:4u7EnebtmKWzUH433cf5Qv","Queen","Bohemian Rhapsody - Remastered 2011","Hollywood Records",42,90,24,"2298894"
106,"spotify:track:6eiztdXRkooWsBt2xToMWI","Juice WRLD","Make Believe","Grade A Productions/Interscope Records",24,74,5,"2279409"
107,"spotify:track:0rKtyWc8bvkriBthvHKY8d","Joji","SLOW DANCING IN THE DARK","88rising Music/Warner Records",29,92,29,"2274107"
108,"spotify:track:2uIX8YMNjGMD7441kqyyNU","Billie Eilish","ocean eyes","Darkroom",78,83,42,"2236393"
109,"spotify:track:7pMRoGLEJuFM2wl5pt0R99","Offset, Travis Scott, 21 Savage","Legacy (feat. Travis Scott & 21 Savage)","Quality Control Music/Motown Records",19,106,7,"2235753"
110,"spotify:track:58q2HKrzhC3ozto2nDdN4z","Cardi B, Bad Bunny, J Balvin","I Like It","Atlantic/KSR",3,102,53,"2231363"
111,"spotify:track:0jAfdqv18goRTUxm3ilRjb","A Boogie Wit da Hoodie, Tyga, Offset","Startender (feat. Offset and Tyga)","Highbridge the Label / Atlantic Records",17,85,17,"2221886"
112,"spotify:track:7ql71hBakyMi0Lxiq3Mugs","The Chainsmokers, 5 Seconds of Summer","Who Do You Love","Disruptor Records/Columbia",33,96,9,"2203135"
113,"spotify:track:2iUXsYOEPhVqEBwsqP70rE","5 Seconds of Summer","Youngblood","Capitol",17,105,52,"2194510"
114,"spotify:track:6JQvHMSaR8flFsN53ypOfP","Lil Mosey","Noticed","Mogul Vision/Interscope Records",20,100,34,"2183965"
115,"spotify:track:7sO5G9EABYOXQKNPNiE9NR","Offset, Metro Boomin","Ric Flair Drip (with Metro Boomin)","Slaughter Gang, LLC/Epic/Quality Control Music/Motown/Capitol/Boominati Worldwide/Republic",4,104,76,"2182531"
116,"spotify:track:4TWflhgevIGo448fWc6mQq","Offset","Red Room","Quality Control Music/Motown Records",22,78,8,"2172965"
117,"spotify:track:5SHhPFh68OhUmuRPymKX9d","FLETCHER","Undrunk","Capitol Records",82,89,5,"2164476"
118,"spotify:track:5JEx7HbmvHQQswJCsoo9rA","Ellie Goulding, Diplo, Swae Lee","Close To Me (with Diplo) (feat. Swae Lee)","Polydor Records",33,110,24,"2140975"
119,"spotify:track:4VXIryQMWpIdGgYR4TrjT1","Juice WRLD","All Girls Are The Same","Juice WRLD Mixtape / ISR P&D",13,101,51,"2140188"
120,"spotify:track:2MShy1GSSgbmGUxADNIao5","Kodak Black","Calling My Spirit","Atlantic Records",31,91,19,"2132722"
121,"spotify:track:51NFxnQvaosfDDutk0tams","Billie Eilish","bellyache","Darkroom",49,99,23,"2132012"
122,"spotify:track:42fw0rxRO2xbesF6mJfd4Y","Dan + Shay","Tequila","Warner Records",60,120,56,"2122344"
123,"spotify:track:6MjNilJCVKJq0LfFvo5jWJ","Juice WRLD","Fast","Grade A Productions/Interscope Records",8,59,5,"2122058"
124,"spotify:track:5Z3GHaZ6ec9bsiI5BenrbY","Khalid","Young Dumb & Broke","Right Hand Music Group, LLC/RCA Records",6,129,104,"2105138"
125,"spotify:track:39xWBHPM4E9MwzEy5gbM7p","Nipsey Hussle, YG","Last Time That I Checc'd (feat. YG)","Atlantic Records",122,122,2,"2091752"
126,"spotify:track:7AQim7LbvFVZJE3O8TYgf2","XXXTENTACION, Trippie Redd","Fuck Love (feat. Trippie Redd)","Bad Vibes Forever / EMPIRE",8,112,85,"2054713"
127,"spotify:track:6ZRuF2n1CQxyxxAAWsKJOy","Kehlani, Ty Dolla $ign","Nights Like This (feat. Ty Dolla $ign)","TSNMI / Atlantic",21,111,13,"2042659"
128,"spotify:track:2P91MQbaiQOfbiz9VqhqKQ","Lauv","I Like Me Better","Lauv",30,123,96,"2035888"
129,"spotify:track:4dAMdQ6g4kGmnc1MDHsg77","NLE Choppa","Shotta Flow","No Love Entertainment",115,115,4,"2034108"
130,"spotify:track:7GX5flRQZVHRAGd6B4TmDO","Lil Uzi Vert","XO Tour Llif3","Generation Now/Atlantic",2,114,107,"2020215"
131,"spotify:track:4e4fqjx0Izh4svvTef1z7e","Bebe Rexha, Florida Georgia Line","Meant to Be (feat. Florida Georgia Line)","Warner Bros.",16,124,83,"2018965"
132,"spotify:track:6GSkLS2y4ZnnZsuRAj975K","Marshmello, Roddy Ricch","Project Dreams","Warner Records",82,119,15,"2008803"
133,"spotify:track:152lZdxL1OR0ZMW6KquMif","Khalid","Location","Right Hand Music Group, LLC/RCA Records",9,134,117,"1994291"
134,"spotify:track:3a1lNhkSLSkpJE4MSHpDu9","Post Malone, Quavo","Congratulations","Universal Records",5,121,120,"1991139"
135,"spotify:track:7uH27oIt4a6cIFCA8ZPcyG","Ozuna","Baila Baila Baila","Aura Music Corp.",100,116,10,"1969907"
136,"spotify:track:6DCZcSspjsKoFjzjrWoCdn","Drake","God's Plan","Cash Money/Drake LP6",1,126,64,"1962728"
137,"spotify:track:6fIjnWrv46njJHLDAY2JdC","Nipsey Hussle, Kendrick Lamar","Dedication (feat. Kendrick Lamar)","Atlantic Records",117,117,2,"1951615"
138,"spotify:track:4SPu0Ql902hTVXkBoNIYtq","Ariana Grande","NASA","Republic Records",3,103,9,"1943175"
139,"spotify:track:2gwkD6igEhQbDQegRCcdoB","DaBaby","Suge","South Coast Music Group/Interscope Records",139,166,2,"1939370"
140,"spotify:track:41MCdlvXOl62B7Kv86Bb1v","Juice WRLD","Empty","Grade A Productions/Interscope Records",13,97,5,"1939050"
141,"spotify:track:3GJ4hzg4lrGwU51Y3VARbF","Dan + Shay","Speechless","Warner Records",85,132,36,"1934606"
142,"spotify:track:4XiGKQqbmnMVxDzUj6j3f2","YK Osiris","Worth It","Def Jam Recordings",119,125,6,"1933907"
143,"spotify:track:1TEL6MlSSVLSdhOSddidlJ","Ariana Grande","needy","Republic Records",4,109,9,"1914847"
144,"spotify:track:1WSGTYKLEpKfNQYYW5Oymt","benny blanco, Selena Gomez, J Balvin, Tainy","I Can’t Get Enough (benny blanco, Selena Gomez, J Balvin, Tainy)","NEON16/Friends Keep Secrets/Interscope Records",27,107,6,"1900869"
145,"spotify:track:4qKcDkK6siZ7Jp1Jb4m0aL","BlocBoy JB, Drake","Look Alive (feat. Drake)","OVO Sound/Warner Records",3,133,61,"1899907"
146,"spotify:track:4w8niZpiMy6qz1mntFA5uM","DJ Snake, Selena Gomez, Ozuna, Cardi B","Taki Taki (with Selena Gomez, Ozuna & Cardi B)","DJ Snake Music Productions Limited, under exclusive license to Geffen Records",7,127,28,"1872163"
147,"spotify:track:4VUwkH455At9kENOfzTqmF","Bazzi, Camila Cabello","Beautiful (feat. Camila Cabello)","iamcosmic",30,142,36,"1861193"
148,"spotify:track:7AFASza1mXqntmGtbxXprO","XXXTENTACION","changes","Bad Vibes Forever, LLC",7,131,58,"1834017"
149,"spotify:track:3R9j8urSPiBbapNbyuSYkE","Nipsey Hussle","Grinding All My Life","Atlantic Records",138,138,3,"1822973"
150,"spotify:track:5T8EDUDqKcs6OSOwEsfqG7","Queen","Don't Stop Me Now - Remastered 2011","Hollywood Records",102,135,19,"1810085"
151,"spotify:track:7KXjTSCq5nL1LoYtL7XAwS","Kendrick Lamar","HUMBLE.","Aftermath",1,150,105,"1804236"
152,"spotify:track:74lnM5V6ecvoTPV0fvptx9","Ski Mask The Slump God, Juice WRLD","Nuketown (feat. Juice WRLD)","Republic Records",18,130,19,"1799376"
153,"spotify:track:7hzlzoOwCZ4D3Ow5YZK4kj","Daya","Insomnia","Interscope Records",153,182,2,"1795591"
154,"spotify:track:7uzmGiiJyRfuViKKK3lVmR","Bazzi","Mine","iamcosmic",4,157,65,"1773743"
155,"spotify:track:01DOm09B2AbiTARAbXVI6g","ScHoolboy Q, Travis Scott","CHopstix (feat. Travis Scott)","Top Dawg Entertainment/Interscope Records",155,-1,1,"1768936"
156,"spotify:track:6gBFPUFcJLzWGx4lenP6h2","Travis Scott","goosebumps","Epic/Grand Hustle",16,149,120,"1767869"
157,"spotify:track:4OBZT9EnhYIV17t4pGw7ig","Daniel Caesar, H.E.R.","Best Part (feat. H.E.R.)","MBK Entertainment/RCA Records",68,137,45,"1764414"
158,"spotify:track:25F6MWrnFBCXVnpN4n76EK","Logic","Keanu Reeves","Def Jam Recordings",13,128,12,"1762324"
159,"spotify:track:62vpWI1CHwFy7tMIcSStl8","J. Cole","No Role Modelz","Roc Nation Records LLC",65,145,95,"1761784"
160,"spotify:track:5W83ErFkO3aKAIS1WMi6u0","Anuel AA, KAROL G","Secreto","Anuel AA & Karol G - Secreto",92,140,12,"1715777"
161,"spotify:track:4NBTZtAt1F13VvlSKe6KTl","The Chainsmokers, Kelsea Ballerini","This Feeling","Disruptor Records/Columbia",25,147,28,"1707496"
162,"spotify:track:45Egmo7icyopuzJN0oMEdk","Khalid, Normani","Love Lies (with Normani)","RCA Records Label",9,173,60,"1700011"
163,"spotify:track:7lAK3oHbfEnvUQWosrMMpR","Travis Scott","YOSEMITE","Cactus Jack / Epic / Grand Hustle",7,143,36,"1695940"
164,"spotify:track:3oDkdAySo1VQQG0ptV7uwa","Juice WRLD","Lean Wit Me","Juice WRLD Mixtape / ISR P&D",28,144,46,"1694622"
165,"spotify:track:3CA9pLiwRIGtUBiMjbZmRw","Drake","Nice For What","Cash Money/Drake LP6",1,161,53,"1690228"
166,"spotify:track:7fa9MBXhVfQ8P8Df9OEbD8","Maroon 5, Cardi B","Girls Like You (feat. Cardi B) - Cardi B Version","Interscope Records*",8,158,45,"1674551"
167,"spotify:track:5274I4mUMnYczyeXkGDWZN","Future, Juice WRLD","Fine China","Epic/Freebandz/Grade A/Interscope",6,152,26,"1669455"
168,"spotify:track:2qG5sZ7Si6sdK74qLxedYM","ROSALÍA, J Balvin, El Guincho","Con Altura","Columbia",136,136,2,"1667149"
169,"spotify:track:4n7jnSxVLd8QioibtTDBDq","Alan Walker, Sabrina Carpenter, Farruko","On My Way","MER Recordings",169,-1,1,"1665408"
170,"spotify:track:7DHApOHsIFo7EyfieArYGE","P!nk","Walk Me Home","RCA Records Label",130,163,7,"1664078"
171,"spotify:track:2qT1uLXPVPzGgFOx4jtEuo","Ariana Grande","no tears left to cry","Republic Records",9,160,51,"1658481"
172,"spotify:track:1KVczjazCcCCgM3gXXUl47","benny blanco, Juice WRLD, Brendon Urie","Roses (with Juice WRLD feat. Brendon Urie)","Friends Keep Secrets/Interscope Records",46,153,18,"1658387"
173,"spotify:track:4dTiQezDWmEOWcdCbWVWMp","ScHoolboy Q","Numb Numb Juice","Top Dawg Entertainment/Interscope Records",23,118,4,"1649533"
174,"spotify:track:2G7V7zsVDxg1yRsu7Ew9RJ","Drake","In My Feelings","Cash Money/Drake LP6",1,164,41,"1648767"
175,"spotify:track:3wLtYwtqvKK2ewelSVPeDK","Roddy Ricch","Die Young","Bird Vision Entertainment",146,146,2,"1645494"
176,"spotify:track:4iVD0fTHGxV9JWloujsL3s","Nipsey Hussle, Belly, Dom Kennedy","Double Up (feat. Belly and Dom Kennedy)","Atlantic Records",148,148,2,"1625257"
177,"spotify:track:32lItqlMi4LBhb4k0BaSaC","Post Malone","Candy Paint","Republic Records",4,171,98,"1605652"
178,"spotify:track:09IStsImFySgyp0pIQdqAc","Zedd, Maren Morris, Grey","The Middle","UMGRI Interscope",7,168,61,"1602929"
179,"spotify:track:51w9Jbat1pLeWINGCpnQUR","Tory Lanez, Rich The Kid, Lil Wayne","TAlk tO Me (with Rich The Kid feat. Lil Wayne) - Remix","Mad Love/Interscope Records",123,151,13,"1598830"
180,"spotify:track:39LmTF9RgyakzSYX8txrow","Ariana Grande","imagine","Republic Records",7,139,17,"1582479"
181,"spotify:track:6foY66mWZN0pSRjZ408c00","Morgan Wallen","Whiskey Glasses","Big Loud Records",178,191,4,"1566393"
182,"spotify:track:2qGfZAgDe1pV2y5xJAhi6R","YoungBoy Never Broke Again","Slime Belief","Never Broke Again, LLC",150,167,8,"1527477"
183,"spotify:track:3GVkPk8mqxz0itaAriG1L7","XXXTENTACION","Everybody Dies In Their Nightmares","Bad Vibes Forever / EMPIRE",15,169,85,"1526829"
184,"spotify:track:698eQRku24PIYPQPHItKlA","Luke Combs","She Got the Best of Me","River House Artists/Columbia Nashville",163,200,6,"1526360"
185,"spotify:track:0ZNrc4kNeQYD9koZ3KvCsy","YG, 2 Chainz, Big Sean, Nicki Minaj","BIG BANK (feat. 2 Chainz, Big Sean, Nicki Minaj)","Def Jam Recordings",24,172,46,"1522632"
186,"spotify:track:2swZ0X1njeU32SNJeBKIfW","Aventura","Inmortal","Sony Music Latin",186,-1,1,"1519370"
187,"spotify:track:4QIyEq7TcTdAcxjI2AFlAK","6ix9ine, Nicki Minaj, Murda Beatz","FEFE","Scumgang Records/TenThousand Projects, LLC",2,179,38,"1512242"
188,"spotify:track:2Jh3UqxnHJMyzMzku4uOtE","Juice WRLD","Feeling","Grade A Productions/Interscope Records",55,165,5,"1507498"
189,"spotify:track:79esEXlqqmq0GPz0xQSZTV","Shawn Mendes","Lost In Japan","Island Records",22,180,21,"1507155"
190,"spotify:track:5iwz1NiezX7WWjnCgY5TH4","Pedro Capó, Farruko","Calma - Remix","Sony Music Latin",114,185,15,"1499759"
191,"spotify:track:1zB4vmk8tFRmM9UULNzbLB","Imagine Dragons","Thunder","Kid Ina Korner / Interscope",21,194,96,"1494891"
192,"spotify:track:4jvjzW7Hm0yK4LvvE0Paz9","Lil Peep, XXXTENTACION","Falling Down - Bonus Track","Columbia",1,176,30,"1491997"
193,"spotify:track:6PfI6EeLNiNGVAVg11nv7D","Gunna","Speed It Up","300 Entertainment",55,192,8,"1487811"
194,"spotify:track:1HXy5I3HTWq8OvxCn0z7G7","Kane Brown","Heaven","RCA Records Label Nashville",60,-1,47,"1484293"
195,"spotify:track:0pqnGHJpmpxLKifKRmU6WP","Imagine Dragons","Believer","Kid Ina Korner / Interscope",11,197,105,"1477026"
196,"spotify:track:7vGuf3Y35N4wmASOKLUVVU","Marshmello, Khalid","Silence","Joytime Collective/RCA Records",10,-1,69,"1471386"
197,"spotify:track:5uCax9HTNlzGybIStD3vDh","James Arthur","Say You Won't Let Go","Columbia",15,187,94,"1471212"
198,"spotify:track:5nzhL67GpF9szXWg5y509A","Lil Baby","Close Friends (Lil Baby & Gunna)","Quality Control Music/Young Stoner Life Records, a 300 Entertainment Label/Motown Records/Capitol Records",39,183,25,"1469645"
199,"spotify:track:0FQhAHyHGsrbSHvDURmFPn","Billie Eilish","my boy","Darkroom",147,154,14,"1465147"
200,"spotify:track:4EnEGf9JzAJhF1XNY9DJcD","G-Eazy, Blueface, ALLBLACK, YG","West Coast (feat. Blueface, ALLBLACK & YG)","BPG/RVG/RCA Records",200,-1,1,"1463743"
